year,age,event,category1,category2,Name
2018,44,"In 2018, Muqtada al-Sadr joined Muqtada al-Sadr's Sadrist political party to the Saairun alliance, which won the highest number of seats in the 2018 and 2021 Iraqi parliamentary elections.",summary,,Muqtada al-Sadr
2008,34,"In early 2008, Muqtada al-Sadr was reported to be studying to be an ayatollah, something that would greatly improve His formal religious standing  within the Shi'i clerical hierarchy.",Titles,,Muqtada al-Sadr
2003,29,Muqtada al-Sadr gained popularity in Iraq following the toppling of the Saddam government by the 2003 US invasion of Iraq.,Political positions,,Muqtada al-Sadr
2004,30,"In Muqtada al-Sadr's 2004 sermons and public interviews, Muqtada al-Sadr repeatedly demanded an immediate withdrawal of all US-led coalition forces, all foreign troops under United Nations control, and the establishment of a new central Iraqi government, not connected to the Ba'ath party or the Allawi government.",Opposition to US presence,2004,Muqtada al-Sadr
2011,37,"Prior to Muqtada al-Sadr's arrival in Najaf, Muqtada al-Sadr had been instrumental in the formation of the 2011 Iraqi government.",Post-US withdrawal,2011–2020,Muqtada al-Sadr
2014,40,"According to Britannica, ""although Muqtada al-Sadr was once an image of Iraqi Shiʿi militancy, Muqtada al-Sadr came to see sectarianism as a source of dysfunction and corruption in government and began steering Muqtada al-Sadr's supporters away from sectarianism.""In February 2014, Muqtada al-Sadr announced that Muqtada al-Sadr was withdrawing from politics and dissolving the party structure to protect Muqtada al-Sadr's family's reputation.",Post-US withdrawal,2011–2020,Muqtada al-Sadr
2020,46,"Following the 8 January 2020 Iranian rocket attacks on US led military bases, however, Muqtada al-Sadr held back and urged Muqtada al-Sadr's not to attack U.S. elements in the country.",Post-US withdrawal,2011–2020,Muqtada al-Sadr
2022,48,"On August 29, 2022, Muqtada al-Sadr announced Muqtada al-Sadr's retirement from Iraq politics and the closure of most of Muqtada al-Sadr's offices and institutions.",Post-US withdrawal,2021–present,Muqtada al-Sadr
